{
    "$schema": "../../schema/generator.level.schema.json",

    "name" : [  { "lang": "en", "value" : "Simple Level with 2 rooms and 1 gate"} ],
    "section": "samples",

    "game_type" : {
        "single_mode" : {
            "execution_time" : 10.0,
            "entry_point_room" : "room1",
            "end_point_room" : "room2"
        }
    },

    "rooms" : [
        {
            "room_id" : "room1",
            "name" : [ { "lang": "en", "value" : "hell"}  ],
            "structure_class" : "rectangular",
            "dressing_class" : "basic"
        },
        {
            "room_id" : "room2",
            "structure_class" : "rectangular",
            "dressing_class" : "basic",
            "name" : [ { "lang": "en", "value" : "heaven"} ]
        },
        {
            "room_id" : "room3",
            "structure_class" : "rectangular",
            "dressing_class" : "basic",
            "name" : [ { "lang": "en", "value" : "earth"} ]
        }
    ],
    "gates" : [
        {
            "gate_id" : "r1r2",
            "connect" : [ "room1", "room2"],
            "accessible" : "from-to",
            "visible" : "from-to",
            "see_through" : "from-to",

            "structure_class" : "simple_door",
            "dressing_class" : "basic"
        },
        {
            "gate_id" : "r2r1",
            "connect" : [ "room2", "room1"],
            "accessible" : "from-to",
            "visible" : "from-to",
            "see_through" : "from-to",

            "structure_class" : "simple_door",
            "dressing_class" : "basic"
        },
        {
            "gate_id" : "r3r1",
            "connect" : [ "room3", "room1"],
            "accessible" : "from-to",
            "visible" : "from-to",
            "see_through" : "from-to",

            "structure_class" : "simple_door",
            "dressing_class" : "basic"
        }
    ]
}

