{
    "$schema": "../../schema/generator.level.schema.json",

    "name" : [  { "lang": "en", "value" : "Simple Level"} ],
    "section": "samples",

    "game_type" : {
        "single_mode" : {
            "execution_time" : 10.0,
            "entry_point_room" : "earth",
            "end_point_room" : "earth",
            "entry_point_position": [ 12.0, 1.0, 0.0 ]
        }
    },
    "rooms" : [
        {
            "room_id" : "earth",
            "name" : [ { "lang": "en", "value" : "earth"}  ],
            "structure_class" : "sphere",
            "dressing_class" : "sphere",
            "structure_parameters": {
                "setup": {
                 "radius": 10,
                 "lats": 50,
                 "longs": 50
                }
            },
            "dressing_parameters": {
                "setup": [
                 [
                  "ground",
                  "/common/planets/earth.jpg"
                 ],
                 [
                  "wall",
                  "/common/planets/earth.jpg"
                 ],
                 [
                  "ceiling",
                  "/common/planets/earth.jpg"
                 ]
                ]
               }
        },
        {
            "room_id" : "sun",
            "name" : [ { "lang": "en", "value" : "sun"}  ],
            "structure_class" : "sphere",
            "dressing_class" : "sphere",
            "dressing_parameters": {
                "setup": [
                 [
                  "ground",
                  "/common/planets/sun.jpg"
                 ],
                 [
                  "wall",
                  "/common/planets/sun.jpg"
                 ],
                 [
                  "ceiling",
                  "/common/planets/sun.jpg"
                 ]
                ]
               },
            "structure_parameters": {
                "setup": {
                 "radius": 50,
                 "lats": 50,
                 "longs": 50
                }
            }
        },
        {
            "room_id" : "mars",
            "name" : [ { "lang": "en", "value" : "mars"}  ],
            "structure_class" : "sphere",
            "dressing_class" : "sphere",
            "dressing_parameters": {
                "setup": [
                 [
                  "ground",
                  "/common/planets/mars.jpg"
                 ],
                 [
                  "wall",
                  "/common/planets/mars.jpg"
                 ],
                 [
                  "ceiling",
                  "/common/planets/mars.jpg"
                 ]
                ]
               },
            "structure_parameters": {
                "setup": {
                 "radius": 8,
                 "lats": 50,
                 "longs": 50
                }
            }
        }
    ],
    "gates" : [
        {
            "gate_id" : "earth_sun",
            "connect" : [ "earth", "sun"],
            "accessible" : "from-to",
            "structure_class" : "simple_door",
            "dressing_class" : "basic"
        },
        {
            "gate_id" : "earth_mars",
            "connect" : [ "earth", "mars"],
            "accessible" : "from-to",
            "structure_class" : "simple_door",
            "dressing_class" : "basic"
        }
     ]
}

